{
  "claim_boundary": "Benchmark-evidence metadata join only. Geometry groups are descriptive topology labels and never imply a causal failure mechanism; predicate availability is consumed from the #5593 export lane when present and is explicit 'unavailable' otherwise; validated mechanisms require a validated causal report and are not derived here. No private manuscript claims are encoded.",
  "content_sha256": "20ecce670caea6d35ddd4f55af4e013dd3fb2ec823df26ded63df5bf990a79d6",
  "evidence_catalog_consumed": false,
  "generated_at_utc": "2026-07-17T10:45:53.644352+00:00",
  "predicate_export_consumed": false,
  "repo_commit": "f1aead3",
  "rows": [
    {
      "evidence": {
        "case_capsule_ids": [],
        "eligibility": "excluded",
        "exclusion_reason": "no_evidence_bundle_provided",
        "generated_candidate_ids": [],
        "replay_ids": [],
        "trace_ids": [],
        "validated_mechanism": null,
        "validated_mechanism_provenance": null
      },
      "geometry_group": "bottleneck (geometry_only)",
      "geometry_group_note": "descriptive topology label; not a causal mechanism",
      "geometry_group_provenance": "config_metadata",
      "hazard_tag_source": "config_metadata",
      "hazard_tags": [],
      "interaction_class": "unknown",
      "map_id": "../../maps/svg_maps/classic_bottleneck_high.svg",
      "predicate_availability": {
        "export_status": "unavailable",
        "export_status_reason": "predicate_export_unavailable",
        "exported_predicates": [],
        "missing_or_degraded_predicates": [],
        "motivated_not_exported_predicates": [
          {
            "motivated_by": "failure_taxonomy",
            "predicate": "oscillatory_control",
            "schema_version": "safety_predicate.oscillatory_control.v1",
            "status": "motivated_not_exported"
          },
          {
            "motivated_by": "failure_taxonomy",
            "predicate": "late_evasive",
            "schema_version": "safety_predicate.late_evasive.v2",
            "status": "motivated_not_exported"
          },
          {
            "motivated_by": "failure_taxonomy",
            "predicate": "occlusion_near_miss",
            "schema_version": "safety_predicate.occlusion_near_miss.v1",
            "status": "motivated_not_exported"
          }
        ]
      },
      "scenario_family": "bottleneck",
      "scenario_id": "classic_bottleneck_high",
      "seeds": [
        131,
        132,
        133
      ],
      "source_config_hash": "58ba0d39aa9e0eef"
    },
    {
      "evidence": {
        "case_capsule_ids": [],
        "eligibility": "excluded",
        "exclusion_reason": "no_evidence_bundle_provided",
        "generated_candidate_ids": [],
        "replay_ids": [],
        "trace_ids": [],
        "validated_mechanism": null,
        "validated_mechanism_provenance": null
      },
      "geometry_group": "bottleneck (geometry_only)",
      "geometry_group_note": "descriptive topology label; not a causal mechanism",
      "geometry_group_provenance": "config_metadata",
      "hazard_tag_source": "config_metadata",
      "hazard_tags": [],
      "interaction_class": "unknown",
      "map_id": "../../maps/svg_maps/classic_bottleneck.svg",
      "predicate_availability": {
        "export_status": "unavailable",
        "export_status_reason": "predicate_export_unavailable",
        "exported_predicates": [],
        "missing_or_degraded_predicates": [],
        "motivated_not_exported_predicates": [
          {
            "motivated_by": "failure_taxonomy",
            "predicate": "oscillatory_control",
            "schema_version": "safety_predicate.oscillatory_control.v1",
            "status": "motivated_not_exported"
          },
          {
            "motivated_by": "failure_taxonomy",
            "predicate": "late_evasive",
            "schema_version": "safety_predicate.late_evasive.v2",
            "status": "motivated_not_exported"
          },
          {
            "motivated_by": "failure_taxonomy",
            "predicate": "occlusion_near_miss",
            "schema_version": "safety_predicate.occlusion_near_miss.v1",
            "status": "motivated_not_exported"
          }
        ]
      },
      "scenario_family": "bottleneck",
      "scenario_id": "classic_bottleneck_low",
      "seeds": [
        131,
        132,
        133
      ],
      "source_config_hash": "707e40cafbe857d0"
    },
    {
      "evidence": {
        "case_capsule_ids": [],
        "eligibility": "excluded",
        "exclusion_reason": "no_evidence_bundle_provided",
        "generated_candidate_ids": [],
        "replay_ids": [],
        "trace_ids": [],
        "validated_mechanism": null,
        "validated_mechanism_provenance": null
      },
      "geometry_group": "bottleneck (geometry_only)",
      "geometry_group_note": "descriptive topology label; not a causal mechanism",
      "geometry_group_provenance": "config_metadata",
      "hazard_tag_source": "config_metadata",
      "hazard_tags": [],
      "interaction_class": "unknown",
      "map_id": "../../maps/svg_maps/classic_bottleneck_medium.svg",
      "predicate_availability": {
        "export_status": "unavailable",
        "export_status_reason": "predicate_export_unavailable",
        "exported_predicates": [],
        "missing_or_degraded_predicates": [],
        "motivated_not_exported_predicates": [
          {
            "motivated_by": "failure_taxonomy",
            "predicate": "oscillatory_control",
            "schema_version": "safety_predicate.oscillatory_control.v1",
            "status": "motivated_not_exported"
          },
          {
            "motivated_by": "failure_taxonomy",
            "predicate": "late_evasive",
            "schema_version": "safety_predicate.late_evasive.v2",
            "status": "motivated_not_exported"
          },
          {
            "motivated_by": "failure_taxonomy",
            "predicate": "occlusion_near_miss",
            "schema_version": "safety_predicate.occlusion_near_miss.v1",
            "status": "motivated_not_exported"
          }
        ]
      },
      "scenario_family": "bottleneck",
      "scenario_id": "classic_bottleneck_medium",
      "seeds": [
        131,
        132,
        133
      ],
      "source_config_hash": "488df820f5774565"
    },
    {
      "evidence": {
        "case_capsule_ids": [],
        "eligibility": "excluded",
        "exclusion_reason": "no_evidence_bundle_provided",
        "generated_candidate_ids": [],
        "replay_ids": [],
        "trace_ids": [],
        "validated_mechanism": null,
        "validated_mechanism_provenance": null
      },
      "geometry_group": "cross_trap (geometry_only)",
      "geometry_group_note": "descriptive topology label; not a causal mechanism",
      "geometry_group_provenance": "config_metadata",
      "hazard_tag_source": "config_metadata",
      "hazard_tags": [],
      "interaction_class": "unknown",
      "map_id": "classic_cross_trap",
      "predicate_availability": {
        "export_status": "unavailable",
        "export_status_reason": "predicate_export_unavailable",
        "exported_predicates": [],
        "missing_or_degraded_predicates": [],
        "motivated_not_exported_predicates": [
          {
            "motivated_by": "failure_taxonomy",
            "predicate": "oscillatory_control",
            "schema_version": "safety_predicate.oscillatory_control.v1",
            "status": "motivated_not_exported"
          },
          {
            "motivated_by": "failure_taxonomy",
            "predicate": "late_evasive",
            "schema_version": "safety_predicate.late_evasive.v2",
            "status": "motivated_not_exported"
          },
          {
            "motivated_by": "failure_taxonomy",
            "predicate": "occlusion_near_miss",
            "schema_version": "safety_predicate.occlusion_near_miss.v1",
            "status": "motivated_not_exported"
          }
        ]
      },
      "scenario_family": "cross_trap",
      "scenario_id": "classic_cross_trap_high",
      "seeds": [
        101,
        102,
        103
      ],
      "source_config_hash": "26ed69e5420a5940"
    },
    {
      "evidence": {
        "case_capsule_ids": [],
        "eligibility": "excluded",
        "exclusion_reason": "no_evidence_bundle_provided",
        "generated_candidate_ids": [],
        "replay_ids": [],
        "trace_ids": [],
        "validated_mechanism": null,
        "validated_mechanism_provenance": null
      },
      "geometry_group": "cross_trap (geometry_only)",
      "geometry_group_note": "descriptive topology label; not a causal mechanism",
      "geometry_group_provenance": "config_metadata",
      "hazard_tag_source": "config_metadata",
      "hazard_tags": [],
      "interaction_class": "unknown",
      "map_id": "classic_cross_trap",
      "predicate_availability": {
        "export_status": "unavailable",
        "export_status_reason": "predicate_export_unavailable",
        "exported_predicates": [],
        "missing_or_degraded_predicates": [],
        "motivated_not_exported_predicates": [
          {
            "motivated_by": "failure_taxonomy",
            "predicate": "oscillatory_control",
            "schema_version": "safety_predicate.oscillatory_control.v1",
            "status": "motivated_not_exported"
          },
          {
            "motivated_by": "failure_taxonomy",
            "predicate": "late_evasive",
            "schema_version": "safety_predicate.late_evasive.v2",
            "status": "motivated_not_exported"
          },
          {
            "motivated_by": "failure_taxonomy",
            "predicate": "occlusion_near_miss",
            "schema_version": "safety_predicate.occlusion_near_miss.v1",
            "status": "motivated_not_exported"
          }
        ]
      },
      "scenario_family": "cross_trap",
      "scenario_id": "classic_cross_trap_low",
      "seeds": [